<?xml version="1.0" encoding="UTF-8"?>
<xs:schema xmlns:xs="http://www.w3.org/2001/XMLSchema">
    <xs:element name="ListKetQua">
        <xs:complexType>
            <xs:sequence>
                <xs:element name="KetQua" maxOccurs="unbounded">
                    <xs:complexType>
                        <xs:sequence>
                            <xs:element name="MaSv" type="xs:string"/>
                            <xs:element name="MaMh" type="xs:string"/>
                            <xs:element name="DiemThi">
                                <xs:simpleType>
                                    <xs:restriction base="xs:float"> 
                                        <xs:minInclusive value="0"/>
                                        <xs:maxInclusive value="10"/>
                                    </xs:restriction>
                                </xs:simpleType>
                            </xs:element>
                        </xs:sequence>
                    </xs:complexType>
                </xs:element>
            </xs:sequence>
        </xs:complexType>
    </xs:element>
</xs:schema>