<?xml version="1.0" encoding="UTF-8"?>
<?xml-stylesheet href="KetQua.xsl" type="text/xsl"?>

<ListKetQua xmlns:xsi="http://www.w3.org/2001/XMLSchema-instance" 
xsi:noNamespaceSchemaLocation="KetQua.xsd">
    <KetQua>
        <MaSv>sv01</MaSv>
        <MaMh>THDC</MaMh>
        <DiemThi>8</DiemThi>
    </KetQua>
    <KetQua>
        <MaSv>sv01</MaSv>
        <MaMh>THVP</MaMh>
        <DiemThi>9.5</DiemThi>
    </KetQua>
    <KetQua>
        <MaSv>sv02</MaSv>
        <MaMh>THDC</MaMh>
        <DiemThi>5.5</DiemThi>
    </KetQua>
    <KetQua>
        <MaSv>sv02</MaSv>
        <MaMh>THVP</MaMh>
        <DiemThi>10</DiemThi>
    </KetQua>
    <KetQua>
        <MaSv>sv03</MaSv>
        <MaMh>THDC</MaMh>
        <DiemThi>9</DiemThi>
    </KetQua>
    <KetQua>
        <MaSv>sv03</MaSv>
        <MaMh>THVP</MaMh>
        <DiemThi>4.5</DiemThi>
    </KetQua>
</ListKetQua>